# name: test/sql/storage/wal/encryption/wal_test_updates_encrypted.test
# description: Test updates with storage with encrypted WAL
# group: [encryption]

# Attach a db
statement ok
ATTACH 'encrypted_wal.db' as encrypted (ENCRYPTION_KEY 'asdf');

statement ok
PRAGMA disable_checkpoint_on_shutdown

statement ok
PRAGMA wal_autocheckpoint='1TB';

statement ok
USE encrypted

statement ok
CREATE TABLE test (a INTEGER, b INTEGER);

statement ok
INSERT INTO test VALUES (11, 22), (13, 22), (12, 21)

statement ok
UPDATE test SET b=b+1 WHERE a=11

query II
SELECT a, b FROM test ORDER BY a
----
11	23
12	21
13	22

statement ok
UPDATE test SET b=b+1 WHERE a=11

query II
SELECT a, b FROM test ORDER BY a
----
11	24
12	21
13	22
